{
  "schema_version": "roboguide.mission-plan/v0.7",
  "mission": {
    "id": "mission-arm-pick-and-place",
    "objective": "两侧障碍都已清除 (狗已走开、可移动障碍已被顶出扇区)。机械臂回转 180° 到自己正后方 (方位 +176°) 拿起目标物体 crate1, 再转回起始方位 (方位 0°) 把它放在 arm_home_drop —— 抓取不写终态, 夹爪在目的地真的松开并落地才本地完成。",
    "actors": [
      {
        "id": "actor-arm"
      }
    ]
  },
  "contexts": [
    {
      "id": "ctx-arm-sweep",
      "roles": [
        {
          "id": "ctx-role-arm",
          "actor": "actor-arm"
        }
      ],
      "relations": [],
      "coupling_mode": "sequential-handoff"
    }
  ],
  "tasks": [
    {
      "id": "task-relocate-crate",
      "description": "完整的取-放搬运: 先转 180° 到基座正后方抓取 crate1, 再转回起始方位把它放下。complete_after=place 要求搬到目的地放下才算完成 (默认 complete_after=grasp 是'拿起即成功')。",
      "context_id": "ctx-arm-sweep",
      "depends_on": [],
      "roles": [
        {
          "id": "role-relocate",
          "context_role": "ctx-role-arm",
          "requirements": {
            "capabilities": [
              {
                "contract": {
                  "namespace": "object",
                  "name": "relocate",
                  "version": "v1"
                },
                "constraints": []
              }
            ],
            "resources": [
              {
                "kind": "space",
                "units": 1
              }
            ]
          },
          "execution_intent": {
            "operation": {
              "namespace": "object",
              "name": "relocate",
              "version": "v1"
            },
            "objective": "把 crate1 从机械臂正后方搬到起始方位的放下点。",
            "parameters": {
              "object": "crate1",
              "destination": "arm_home_drop",
              "complete_after": "place"
            }
          },
          "resource_scope": "task"
        }
      ],
      "timing": {
        "earliest_start_offset_ms": 0,
        "latest_start_offset_ms": null,
        "completion_deadline_offset_ms": null
      },
      "satisfaction": {
        "expected_effect": "crate1 已被放到 arm_home_drop。",
        "basis": "execution-report",
        "verifier": null
      }
    }
  ]
}
